{
  "$schema": "operation-registry.schema.json",
  "registry_version": 1,
  "architecture_version": "0.3",
  "template_contract_version": 1,
  "stages": [
    "geometry_understanding",
    "modeling_strategy_scripting",
    "execution_recovery",
    "validation_visual_review"
  ],
  "extension_points": [
    {
      "extension_id": "source.video-temporal-observation",
      "status": "reserved",
      "purpose": "Reserve a future adapter for geometry observations derived from video or screen recording.",
      "entry_from": "workflow_input",
      "input_contract": "video_or_screen_recording_source",
      "output_contract": "temporal_observation_contract",
      "reentry_stage": "geometry_understanding",
      "bypass_core_stages": false,
      "contract_path": null
    },
    {
      "extension_id": "learning.demonstrated-modeling-candidate",
      "status": "reserved",
      "purpose": "Reserve a future learning stage that converts a validated modeling demonstration into a candidate reusable operation.",
      "entry_from": "validation_visual_review",
      "input_contract": "validated_demonstration_bundle",
      "output_contract": "candidate_operation_template",
      "reentry_stage": "geometry_understanding",
      "bypass_core_stages": false,
      "contract_path": null
    }
  ],
  "fallback": {
    "enabled": true,
    "entrypoint": "SKILL.md",
    "conditions": [
      "no active template matches",
      "a template precondition is unmet",
      "the target environment is unsupported by the template",
      "the template conflicts with the accepted geometry contract"
    ]
  },
  "operations": [
    {
      "operation_id": "modeling_strategy_scripting.package-scscript",
      "stage": "modeling_strategy_scripting",
      "status": "active",
      "template_version": "0.1.1",
      "template_path": "assets/operation-templates/modeling-strategy-scripting/package-scscript.json",
      "template_sha256": "e01325a7184edd0d1960efb4369b6a206bb94bc301aae6ed569742fd142be3d5",
      "trigger_summary": "Package a prepared version-matched source as a deterministic SpaceClaim script archive.",
      "evidence_layers": [
        "design_only",
        "host_checked"
      ]
    },
    {
      "operation_id": "modeling_strategy_scripting.audit-scscript",
      "stage": "modeling_strategy_scripting",
      "status": "active",
      "template_version": "0.1.1",
      "template_path": "assets/operation-templates/modeling-strategy-scripting/audit-scscript.json",
      "template_sha256": "356f0f7db1e2e855d41f7e94641e8a6e1da8c23972342bc6afb9417071dd4a2e",
      "trigger_summary": "Audit a SpaceClaim script archive for structure, API markers, unsafe paths, and forbidden recorded aliases.",
      "evidence_layers": [
        "design_only",
        "host_checked"
      ]
    },
    {
      "operation_id": "validation_visual_review.validate-runtime-report-schema",
      "stage": "validation_visual_review",
      "status": "active",
      "template_version": "0.1.0",
      "template_path": "assets/operation-templates/validation-visual-review/validate-runtime-report-schema.json",
      "template_sha256": "1440a21095e112a806ddd3b3ca7a09af0c92b49b29aa0dcf8512737c8f9b7357",
      "trigger_summary": "Validate the structure and internal invariants of one declared SpaceClaim runtime report on the host.",
      "evidence_layers": [
        "design_only",
        "host_checked"
      ]
    },
    {
      "operation_id": "validation_visual_review.compare-runtime-report-to-contract",
      "stage": "validation_visual_review",
      "status": "active",
      "template_version": "0.1.0",
      "template_path": "assets/operation-templates/validation-visual-review/compare-runtime-report-to-contract.json",
      "template_sha256": "7bab2ccd8473b34990879c866f622a6beba9ee51508efe57f420e667196a168c",
      "trigger_summary": "Compare one structurally valid runtime report with one expected measurement contract on the host.",
      "evidence_layers": [
        "design_only",
        "host_checked"
      ]
    },
    {
      "operation_id": "validation_visual_review.compare-runtime-reports",
      "stage": "validation_visual_review",
      "status": "active",
      "template_version": "0.1.1",
      "template_path": "assets/operation-templates/validation-visual-review/compare-runtime-reports.json",
      "template_sha256": "2c6a9e3bdb1ce370d2e1a8575f58b08fd519d97e2b38b79d16852619c50cb90f",
      "trigger_summary": "Compare declared forward and native-reopen geometry measurements and names on the host.",
      "evidence_layers": [
        "design_only",
        "host_checked"
      ]
    },
    {
      "operation_id": "geometry_understanding.identify-source-type",
      "stage": "geometry_understanding",
      "status": "candidate",
      "template_version": "0.3.1",
      "template_path": "assets/operation-templates/geometry-understanding/atoms/identify-source-type.json",
      "template_sha256": "1c702971750edc26d4fdcb10189c76f288a6747e8cdaffed237fe1b13dfbf0c2",
      "trigger_summary": "识别输入来源类型 when its declared inputs are available.",
      "evidence_layers": [
        "design_only",
        "host_checked"
      ]
    },
    {
      "operation_id": "geometry_understanding.record-source-provenance",
      "stage": "geometry_understanding",
      "status": "candidate",
      "template_version": "0.3.1",
      "template_path": "assets/operation-templates/geometry-understanding/atoms/record-source-provenance.json",
      "template_sha256": "9bd8311ac888ecbf502832626f080543c4f9c3155a536e5e7084046bdce17084",
      "trigger_summary": "建立来源记录 when its declared inputs are available.",
      "evidence_layers": [
        "design_only",
        "host_checked"
      ]
    },
    {
      "operation_id": "geometry_understanding.identify-view-projection",
      "stage": "geometry_understanding",
      "status": "candidate",
      "template_version": "0.3.1",
      "template_path": "assets/operation-templates/geometry-understanding/atoms/identify-view-projection.json",
      "template_sha256": "7b9333333db00fecd656c14406e02aa550cc5f40c73c9771039169ded70e92ed",
      "trigger_summary": "识别一个视图及投影关系 when its declared inputs are available.",
      "evidence_layers": [
        "design_only",
        "host_checked"
      ]
    },
    {
      "operation_id": "geometry_understanding.correspond-items-across-views",
      "stage": "geometry_understanding",
      "status": "candidate",
      "template_version": "0.3.1",
      "template_path": "assets/operation-templates/geometry-understanding/atoms/correspond-items-across-views.json",
      "template_sha256": "c66fe908aa46e13034ebb996de5d731d54b0a9b3008ca5c9c3f1f39ea2b84f2b",
      "trigger_summary": "建立两个视图间的对应关系 when its declared inputs are available.",
      "evidence_layers": [
        "design_only",
        "host_checked"
      ]
    },
    {
      "operation_id": "geometry_understanding.identify-geometric-primitive",
      "stage": "geometry_understanding",
      "status": "candidate",
      "template_version": "0.3.1",
      "template_path": "assets/operation-templates/geometry-understanding/atoms/identify-geometric-primitive.json",
      "template_sha256": "e996fe6bcd85a3808b25714cc7a28848f644773b333d4081489b75aeef915a2d",
      "trigger_summary": "识别一个几何基元 when its declared inputs are available.",
      "evidence_layers": [
        "design_only",
        "host_checked"
      ]
    },
    {
      "operation_id": "geometry_understanding.identify-planar-profile",
      "stage": "geometry_understanding",
      "status": "candidate",
      "template_version": "0.3.1",
      "template_path": "assets/operation-templates/geometry-understanding/atoms/identify-planar-profile.json",
      "template_sha256": "3ddebc3d130435916b89c4802602747ae475d49a589d726224fd4ef20e2c2b4a",
      "trigger_summary": "识别一个平面轮廓 when its declared inputs are available.",
      "evidence_layers": [
        "design_only",
        "host_checked"
      ]
    },
    {
      "operation_id": "geometry_understanding.identify-local-feature",
      "stage": "geometry_understanding",
      "status": "candidate",
      "template_version": "0.3.1",
      "template_path": "assets/operation-templates/geometry-understanding/atoms/identify-local-feature.json",
      "template_sha256": "d478a3ab4b8dd3b587e59b6b845f799307be0041096d8c35f551a35df7f295f9",
      "trigger_summary": "识别一个局部特征 when its declared inputs are available.",
      "evidence_layers": [
        "design_only",
        "host_checked"
      ]
    },
    {
      "operation_id": "geometry_understanding.identify-spatial-relation",
      "stage": "geometry_understanding",
      "status": "candidate",
      "template_version": "0.3.1",
      "template_path": "assets/operation-templates/geometry-understanding/atoms/identify-spatial-relation.json",
      "template_sha256": "628291286f10f2060b92b430194b9d9367b9bfe15874e81cb413d0dcb3f10d75",
      "trigger_summary": "识别一个空间关系 when its declared inputs are available.",
      "evidence_layers": [
        "design_only",
        "host_checked"
      ]
    },
    {
      "operation_id": "geometry_understanding.identify-symmetry-relation",
      "stage": "geometry_understanding",
      "status": "candidate",
      "template_version": "0.3.1",
      "template_path": "assets/operation-templates/geometry-understanding/atoms/identify-symmetry-relation.json",
      "template_sha256": "17555dc58cb0d30b9285a1e2683c1cf30fa930a7a48977fa7ced647664cf836f",
      "trigger_summary": "识别一个对称关系 when its declared inputs are available.",
      "evidence_layers": [
        "design_only",
        "host_checked"
      ]
    },
    {
      "operation_id": "geometry_understanding.identify-repetition-rule",
      "stage": "geometry_understanding",